{
  "observation_id": "77777777-7777-4777-8777-777777777777",
  "asset_id": "11111111-1111-4111-8111-111111111111",
  "variant_id": "33333333-3333-4333-8333-333333333333",
  "kind": "embedding",
  "status": "generated",
  "provenance": {
    "provider": "local",
    "runtime": "ort-2.x",
    "model": "multilingual-e5-small",
    "model_revision": "sha256:dddddddddddddddddddddddddddddddddddddddddddddddddddddddddddddddd",
    "recipe": "caption-text-embedding-v1",
    "source_variant_digest": {
      "algorithm": "sha256",
      "hex": "bbbbbbbbbbbbbbbbbbbbbbbbbbbbbbbbbbbbbbbbbbbbbbbbbbbbbbbbbbbbbbbb",
      "bytes": 12288
    },
    "created_at": "2026-07-31T05:16:00Z"
  },
  "confidence": 0.93,
  "payload": {
    "payload_kind": "embedding",
    "space": "caption_text",
    "model": "multilingual-e5-small",
    "model_revision": "sha256:dddddddddddddddddddddddddddddddddddddddddddddddddddddddddddddddd",
    "dimension": 384,
    "metric": "cosine",
    "vector_reference": "embedding:77777777-7777-4777-8777-777777777777",
    "source_text_digest": {
      "algorithm": "sha256",
      "hex": "eeeeeeeeeeeeeeeeeeeeeeeeeeeeeeeeeeeeeeeeeeeeeeeeeeeeeeeeeeeeeeee",
      "bytes": 54
    }
  },
  "created_at": "2026-07-31T05:16:00Z"
}
